{
  "case_id": "CN-B1B2-FAKE-TEST-001",
  "identity": {
    "surname": "LI",
    "given_names": "MING",
    "native_full_name": "李明",
    "sex": "MALE",
    "marital_status": "SINGLE",
    "date_of_birth": "1992-03-14",
    "birth_city": "BEIJING",
    "birth_province": "BEIJING",
    "birth_country": "CHINA",
    "nationality": "CHINA",
    "passport_number": "E98765432",
    "passport_issuance_country": "CHINA",
    "passport_issue_date": "2024-01-08",
    "passport_expiration_date": "2034-01-07",
    "passport_book_number": null,
    "source_ids": ["passport_scan_test"]
  },
  "travel_plan": {
    "visa_class": "B1/B2",
    "purpose_notes": "Attend a short industry meetup in Seattle and spend a few days on personal travel.",
    "intended_arrival_date": "2026-10-06",
    "intended_length_of_stay_value": "10",
    "intended_length_of_stay_unit": "DAYS",
    "payer_name": "Beijing Demo Technology Co., Ltd.",
    "us_contact_name": "Olivia Chen",
    "us_contact_organization": "Northwest Business Forum",
    "us_contact_address_line1": "800 Pine Street",
    "us_contact_city": "Seattle",
    "us_contact_state": "Washington",
    "us_contact_postal_code": "98101",
    "us_contact_phone": "+1 206 555 0198",
    "us_contact_email": "olivia.chen@exampleforum.test",
    "source_ids": ["itinerary_email_test", "event_invitation_test"]
  },
  "employment_education": {
    "primary_occupation": "BUSINESSPERSON",
    "current_employer_name": "Beijing Demo Technology Co., Ltd.",
    "current_employer_address": "88 Demo Plaza, Chaoyang District, Beijing, China",
    "monthly_income_local": "28000",
    "school_name": null,
    "source_ids": ["employment_letter_test"]
  },
  "family_contacts": {
    "father_full_name": "LI GUOQIANG",
    "mother_full_name": "ZHANG YAN",
    "spouse_full_name": null,
    "us_relative_name": null,
    "us_relative_status": null,
    "source_ids": ["family_intake_form_test"]
  },
  "security_background": {
    "yes_no_answers": {
      "communicable_disease": false,
      "arrest_history": false
    },
    "explanations": {},
    "source_ids": ["security_review_form_test"]
  },
  "evidence_catalog": [
    {
      "id": "passport_scan_test",
      "kind": "passport",
      "description": "Test passport bio page scan."
    },
    {
      "id": "itinerary_email_test",
      "kind": "itinerary",
      "description": "Test itinerary email showing flights and hotel dates."
    },
    {
      "id": "event_invitation_test",
      "kind": "invitation",
      "description": "Industry forum invitation letter for Seattle event."
    },
    {
      "id": "employment_letter_test",
      "kind": "employment",
      "description": "Employer certificate used for local chain testing."
    },
    {
      "id": "family_intake_form_test",
      "kind": "intake_form",
      "description": "Manual confirmation form for parental details."
    },
    {
      "id": "security_review_form_test",
      "kind": "review_form",
      "description": "Signed security background questionnaire with no findings."
    }
  ]
}
